country_slug,country_name,subdivision_type,subdivision_slug,subdivision_name,subdivision_wikidata_id,subdivision_wikipedia_url,capital_name,capital_wikidata_id,capital_wikipedia_url,borders_subdivisions,borders_countries,borders_waters,connections,locator_svg_path,base_svg_path,notes
iran,Iran,province,alborz,Alborz,Q392522,https://en.wikipedia.org/wiki/Alborz_province,Karaj,Q36529,https://en.wikipedia.org/wiki/Karaj,Markazi | Mazandaran | Qazvin | Tehran,,,"Borders peer subdivisions: Markazi, Mazandaran, Qazvin, Tehran",maps/locators/iran/alborz.svg,maps/base/iran/iran-provinces.svg,
iran,Iran,province,ardabil,Ardabil,Q134228,https://en.wikipedia.org/wiki/Ardabil_province,Ardabil,Q180103,https://en.wikipedia.org/wiki/Ardabil,East Azarbaijan | Gilan | Zanjan,Azerbaijan,,"Borders peer subdivisions: East Azarbaijan, Gilan, Zanjan; Countries: Azerbaijan",maps/locators/iran/ardabil.svg,maps/base/iran/iran-provinces.svg,
iran,Iran,province,bushehr,Bushehr,Q132945,https://en.wikipedia.org/wiki/Bushehr_province,Bushehr,Q158928,https://en.wikipedia.org/wiki/Bushehr,Fars | Hormozgan | Khuzestan,,Persian Gulf,"Borders peer subdivisions: Fars, Hormozgan, Khuzestan; Waters: Persian Gulf",maps/locators/iran/bushehr.svg,maps/base/iran/iran-provinces.svg,
iran,Iran,province,chahar-mahaal-and-bakhtiari,Chaharmahal and Bakhtiari,Q171702,https://en.wikipedia.org/wiki/Chaharmahal_and_Bakhtiari_province,Shahr-e Kord,Q386649,https://en.wikipedia.org/wiki/Shahr-e_Kord,Isfahan | Khuzestan | Kohgiluyeh and Boyer-Ahmad | Lorestan,,,"Borders peer subdivisions: Isfahan, Khuzestan, Kohgiluyeh and Boyer-Ahmad, Lorestan",maps/locators/iran/chahar-mahaal-and-bakhtiari.svg,maps/base/iran/iran-provinces.svg,
iran,Iran,province,east-azerbaijan,East Azarbaijan,Q176081,https://en.wikipedia.org/wiki/East_Azerbaijan_province,Tabriz,Q80053,https://en.wikipedia.org/wiki/Tabriz,Ardabil | West Azarbaijan | Zanjan,Armenia | Azerbaijan,,"Borders peer subdivisions: Ardabil, West Azarbaijan, Zanjan; Countries: Armenia, Azerbaijan",maps/locators/iran/east-azerbaijan.svg,maps/base/iran/iran-provinces.svg,
iran,Iran,province,fars,Fars,Q1004666,https://en.wikipedia.org/wiki/Fars_province,Shiraz,Q6397066,https://en.wikipedia.org/wiki/Shiraz,Bushehr | Hormozgan | Isfahan | Kerman | Kohgiluyeh and Boyer-Ahmad | Yazd,,,"Borders peer subdivisions: Bushehr, Hormozgan, Isfahan, Kerman, Kohgiluyeh and Boyer-Ahmad, Yazd",maps/locators/iran/fars.svg,maps/base/iran/iran-provinces.svg,
iran,Iran,province,gilan,Gilan,Q928828,https://en.wikipedia.org/wiki/Gilan_province,Rasht,Q178373,https://en.wikipedia.org/wiki/Rasht,Ardabil | Mazandaran | Qazvin | Zanjan,Azerbaijan,Caspian Sea,"Borders peer subdivisions: Ardabil, Mazandaran, Qazvin, Zanjan; Countries: Azerbaijan; Waters: Caspian Sea",maps/locators/iran/gilan.svg,maps/base/iran/iran-provinces.svg,
iran,Iran,province,golestan,Golestan,Q170041,https://en.wikipedia.org/wiki/Golestan_province,Gorgan,Q188155,https://en.wikipedia.org/wiki/Gorgan,Mazandaran | North Khorasan | Semnan,Turkmenistan,Caspian Sea,"Borders peer subdivisions: Mazandaran, North Khorasan, Semnan; Countries: Turkmenistan; Waters: Caspian Sea",maps/locators/iran/golestan.svg,maps/base/iran/iran-provinces.svg,
iran,Iran,province,hamadan,Hamadan,Q187373,https://en.wikipedia.org/wiki/Hamadan_province,Hamadan,Q28587,https://en.wikipedia.org/wiki/Hamadan,Kermanshah | Kurdistan | Lorestan | Markazi | Qazvin | Zanjan,,,"Borders peer subdivisions: Kermanshah, Kurdistan, Lorestan, Markazi, Qazvin, Zanjan",maps/locators/iran/hamadan.svg,maps/base/iran/iran-provinces.svg,
iran,Iran,province,hormozgan,Hormozgan,Q633659,https://en.wikipedia.org/wiki/Hormozgan_province,Bandar Abbas,Q154814,https://en.wikipedia.org/wiki/Bandar_Abbas,Bushehr | Fars | Kerman | Sistan and Baluchestan,,Gulf of Oman | Persian Gulf,"Borders peer subdivisions: Bushehr, Fars, Kerman, Sistan and Baluchestan; Waters: Gulf of Oman, Persian Gulf",maps/locators/iran/hormozgan.svg,maps/base/iran/iran-provinces.svg,
iran,Iran,province,ilam,Ilam,Q170570,https://en.wikipedia.org/wiki/Ilam_province,Ilam,Q499470,https://en.wikipedia.org/wiki/Ilam%2C_Iran,Kermanshah | Khuzestan | Lorestan,Iraq,,"Borders peer subdivisions: Kermanshah, Khuzestan, Lorestan; Countries: Iraq",maps/locators/iran/ilam.svg,maps/base/iran/iran-provinces.svg,
iran,Iran,province,isfahan,Isfahan,Q1367759,https://en.wikipedia.org/wiki/Isfahan_province,Isfahan,Q42053,https://en.wikipedia.org/wiki/Isfahan,Chaharmahal and Bakhtiari | Fars | Kohgiluyeh and Boyer-Ahmad | Lorestan | Markazi | Qom | Semnan | South Khorasan | Yazd,,,"Borders peer subdivisions: Chaharmahal and Bakhtiari, Fars, Kohgiluyeh and Boyer-Ahmad, Lorestan, Markazi, Qom, Semnan, South Khorasan, Yazd",maps/locators/iran/isfahan.svg,maps/base/iran/iran-provinces.svg,
iran,Iran,province,kerman,Kerman,Q165352,https://en.wikipedia.org/wiki/Kerman_province,Kerman,Q171714,https://en.wikipedia.org/wiki/Kerman,Fars | Hormozgan | Sistan and Baluchestan | South Khorasan | Yazd,,,"Borders peer subdivisions: Fars, Hormozgan, Sistan and Baluchestan, South Khorasan, Yazd",maps/locators/iran/kerman.svg,maps/base/iran/iran-provinces.svg,
iran,Iran,province,kermanshah,Kermanshah,Q174010,https://en.wikipedia.org/wiki/Kermanshah_province,Kermanshah,Q180078,https://en.wikipedia.org/wiki/Kermanshah,Hamadan | Ilam | Kurdistan | Lorestan,Iraq,,"Borders peer subdivisions: Hamadan, Ilam, Kurdistan, Lorestan; Countries: Iraq",maps/locators/iran/kermanshah.svg,maps/base/iran/iran-provinces.svg,
iran,Iran,province,khuzestan,Khuzestan,Q241119,https://en.wikipedia.org/wiki/Khuzestan_province,Ahvaz,Q170366,https://en.wikipedia.org/wiki/Ahvaz,Bushehr | Chaharmahal and Bakhtiari | Ilam | Kohgiluyeh and Boyer-Ahmad | Lorestan,Iraq,Persian Gulf,"Borders peer subdivisions: Bushehr, Chaharmahal and Bakhtiari, Ilam, Kohgiluyeh and Boyer-Ahmad, Lorestan; Countries: Iraq; Waters: Persian Gulf",maps/locators/iran/khuzestan.svg,maps/base/iran/iran-provinces.svg,
iran,Iran,province,kohgiluyeh-and-boyer-ahmad,Kohgiluyeh and Boyer-Ahmad,Q180068,https://en.wikipedia.org/wiki/Kohgiluyeh_and_Boyer-Ahmad_province,Yasuj,Q383129,https://en.wikipedia.org/wiki/Yasuj,Bushehr | Chaharmahal and Bakhtiari | Fars | Isfahan | Khuzestan,,,"Borders peer subdivisions: Bushehr, Chaharmahal and Bakhtiari, Fars, Isfahan, Khuzestan",maps/locators/iran/kohgiluyeh-and-boyer-ahmad.svg,maps/base/iran/iran-provinces.svg,
iran,Iran,province,kurdistan,Kurdistan,Q134386,https://en.wikipedia.org/wiki/Kurdistan_province,Sanandaj,Q272093,https://en.wikipedia.org/wiki/Sanandaj,Hamadan | Kermanshah | West Azarbaijan | Zanjan,Iraq,,"Borders peer subdivisions: Hamadan, Kermanshah, West Azarbaijan, Zanjan; Countries: Iraq",maps/locators/iran/kurdistan.svg,maps/base/iran/iran-provinces.svg,
iran,Iran,province,lorestan,Lorestan,Q1131727,https://en.wikipedia.org/wiki/Lorestan_province,Khorramabad,Q502212,https://en.wikipedia.org/wiki/Khorramabad,Chaharmahal and Bakhtiari | Hamadan | Ilam | Isfahan | Kermanshah | Khuzestan | Markazi,,,"Borders peer subdivisions: Chaharmahal and Bakhtiari, Hamadan, Ilam, Isfahan, Kermanshah, Khuzestan, Markazi",maps/locators/iran/lorestan.svg,maps/base/iran/iran-provinces.svg,
iran,Iran,province,markazi,Markazi,Q134417,https://en.wikipedia.org/wiki/Markazi_province,Arak,Q212628,https://en.wikipedia.org/wiki/Arak%2C_Iran,Alborz | Hamadan | Isfahan | Lorestan | Qazvin | Qom | Tehran,,,"Borders peer subdivisions: Alborz, Hamadan, Isfahan, Lorestan, Qazvin, Qom, Tehran",maps/locators/iran/markazi.svg,maps/base/iran/iran-provinces.svg,
iran,Iran,province,mazandaran,Mazandaran,Q308864,https://en.wikipedia.org/wiki/Mazandaran_province,Sari,Q168843,https://en.wikipedia.org/wiki/Sari%2C_Iran,Alborz | Gilan | Golestan | Qazvin | Semnan | Tehran,,Caspian Sea,"Borders peer subdivisions: Alborz, Gilan, Golestan, Qazvin, Semnan, Tehran; Waters: Caspian Sea",maps/locators/iran/mazandaran.svg,maps/base/iran/iran-provinces.svg,
iran,Iran,province,north-khorasan,North Khorasan,Q180075,https://en.wikipedia.org/wiki/North_Khorasan_province,Bojnord,Q317946,https://en.wikipedia.org/wiki/Bojnord,Golestan | Razavi Khorasan | Semnan,Turkmenistan,,"Borders peer subdivisions: Golestan, Razavi Khorasan, Semnan; Countries: Turkmenistan",maps/locators/iran/north-khorasan.svg,maps/base/iran/iran-provinces.svg,
iran,Iran,province,qazvin,Qazvin,Q1105893,https://en.wikipedia.org/wiki/Qazvin_province,Qazvin,Q181578,https://en.wikipedia.org/wiki/Qazvin,Alborz | Gilan | Hamadan | Markazi | Mazandaran | Zanjan,,,"Borders peer subdivisions: Alborz, Gilan, Hamadan, Markazi, Mazandaran, Zanjan",maps/locators/iran/qazvin.svg,maps/base/iran/iran-provinces.svg,
iran,Iran,province,qom,Qom,Q131664,https://en.wikipedia.org/wiki/Qom_province,Qom,Q170573,https://en.wikipedia.org/wiki/Qom,Isfahan | Markazi | Semnan | Tehran,,,"Borders peer subdivisions: Isfahan, Markazi, Semnan, Tehran",maps/locators/iran/qom.svg,maps/base/iran/iran-provinces.svg,
iran,Iran,province,razavi-khorasan,Razavi Khorasan,Q587090,https://en.wikipedia.org/wiki/Razavi_Khorasan_province,Mashhad,Q121157,https://en.wikipedia.org/wiki/Mashhad,North Khorasan,Afghanistan,,Borders peer subdivisions: North Khorasan; Countries: Afghanistan,maps/locators/iran/razavi-khorasan.svg,maps/base/iran/iran-provinces.svg,
iran,Iran,province,semnan,Semnan,Q168949,https://en.wikipedia.org/wiki/Semnan_province,Semnan,Q203045,https://en.wikipedia.org/wiki/Semnan%2C_Iran,Golestan | Isfahan | Mazandaran | North Khorasan | Qom | Razavi Khorasan | South Khorasan | Tehran,,,"Borders peer subdivisions: Golestan, Isfahan, Mazandaran, North Khorasan, Qom, Razavi Khorasan, South Khorasan, Tehran",maps/locators/iran/semnan.svg,maps/base/iran/iran-provinces.svg,
iran,Iran,province,sistan-and-baluchistan,Sistan and Baluchestan,Q939575,https://en.wikipedia.org/wiki/Sistan_and_Baluchestan_province,Zahedan,Q140561,https://en.wikipedia.org/wiki/Zahedan,Hormozgan | Kerman | South Khorasan,Afghanistan | Pakistan,Gulf of Oman,"Borders peer subdivisions: Hormozgan, Kerman, South Khorasan; Countries: Afghanistan, Pakistan; Waters: Gulf of Oman",maps/locators/iran/sistan-and-baluchistan.svg,maps/base/iran/iran-provinces.svg,
iran,Iran,province,south-khorasan,South Khorasan,Q171551,https://en.wikipedia.org/wiki/South_Khorasan_province,Birjand,Q193806,https://en.wikipedia.org/wiki/Birjand,Isfahan | Kerman | Razavi Khorasan | Semnan | Sistan and Baluchestan | Yazd,Afghanistan,,"Borders peer subdivisions: Isfahan, Kerman, Razavi Khorasan, Semnan, Sistan and Baluchestan, Yazd; Countries: Afghanistan",maps/locators/iran/south-khorasan.svg,maps/base/iran/iran-provinces.svg,
iran,Iran,province,tehran,Tehran,Q590866,https://en.wikipedia.org/wiki/Tehran_province,Tehran,Q3616,https://en.wikipedia.org/wiki/Tehran,Alborz | Markazi | Mazandaran | Qom | Semnan,,,"Borders peer subdivisions: Alborz, Markazi, Mazandaran, Qom, Semnan",maps/locators/iran/tehran.svg,maps/base/iran/iran-provinces.svg,
iran,Iran,province,west-azerbaijan,West Azarbaijan,Q134411,https://en.wikipedia.org/wiki/West_Azerbaijan_province,Urmia,Q179665,https://en.wikipedia.org/wiki/Urmia,East Azarbaijan | Kurdistan | Zanjan,Azerbaijan | Iraq | Turkey,,"Borders peer subdivisions: East Azarbaijan, Kurdistan, Zanjan; Countries: Azerbaijan, Iraq, Turkey",maps/locators/iran/west-azerbaijan.svg,maps/base/iran/iran-provinces.svg,
iran,Iran,province,yazd,Yazd,Q170568,https://en.wikipedia.org/wiki/Yazd_province,Yazd,Q182394,https://en.wikipedia.org/wiki/Yazd,Fars | Isfahan | Kerman | South Khorasan,,,"Borders peer subdivisions: Fars, Isfahan, Kerman, South Khorasan",maps/locators/iran/yazd.svg,maps/base/iran/iran-provinces.svg,
iran,Iran,province,zanjan,Zanjan,Q146726,https://en.wikipedia.org/wiki/Zanjan_province,Zanjan,Q146699,https://en.wikipedia.org/wiki/Zanjan%2C_Iran,Ardabil | East Azarbaijan | Gilan | Hamadan | Kurdistan | Qazvin | West Azarbaijan,,,"Borders peer subdivisions: Ardabil, East Azarbaijan, Gilan, Hamadan, Kurdistan, Qazvin, West Azarbaijan",maps/locators/iran/zanjan.svg,maps/base/iran/iran-provinces.svg,
mexico,Mexico,federative entity,aguascalientes,Aguascalientes,Q79952,https://en.wikipedia.org/wiki/Aguascalientes,Aguascalientes City,Q200805,https://en.wikipedia.org/wiki/Aguascalientes_%28city%29,Jalisco | Zacatecas,,,"Borders peer subdivisions: Jalisco, Zacatecas",maps/locators/mexico/aguascalientes.svg,maps/base/mexico/mexico-states.svg,
mexico,Mexico,federative entity,baja-california,Baja California,Q58731,https://en.wikipedia.org/wiki/Baja_California,Mexicali,Q199440,https://en.wikipedia.org/wiki/Mexicali,Baja California Sur | Sonora,United States,Gulf of California | Pacific Ocean,"Borders peer subdivisions: Baja California Sur, Sonora; Countries: United States; Waters: Gulf of California, Pacific Ocean",maps/locators/mexico/baja-california.svg,maps/base/mexico/mexico-states.svg,
mexico,Mexico,federative entity,baja-california-sur,Baja California Sur,Q46508,https://en.wikipedia.org/wiki/Baja_California_Sur,La Paz,Q214215,https://en.wikipedia.org/wiki/La_Paz%2C_Baja_California_Sur,Baja California,,Gulf of California | Pacific Ocean,"Borders peer subdivisions: Baja California; Waters: Gulf of California, Pacific Ocean",maps/locators/mexico/baja-california-sur.svg,maps/base/mexico/mexico-states.svg,
mexico,Mexico,federative entity,campeche,Campeche,Q80908,https://en.wikipedia.org/wiki/Campeche,San Francisco de Campeche,Q61301,https://en.wikipedia.org/wiki/Campeche_%28city%29,Quintana Roo | Tabasco | Yucatán,Belize,Gulf of Mexico,"Borders peer subdivisions: Quintana Roo, Tabasco, Yucatán; Countries: Belize; Waters: Gulf of Mexico",maps/locators/mexico/campeche.svg,maps/base/mexico/mexico-states.svg,
mexico,Mexico,federative entity,chiapas,Chiapas,Q60123,https://en.wikipedia.org/wiki/Chiapas,Tuxtla Gutiérrez,Q207429,https://en.wikipedia.org/wiki/Tuxtla_Guti%C3%A9rrez,Oaxaca | Tabasco | Veracruz,Guatemala,Pacific Ocean,"Borders peer subdivisions: Oaxaca, Tabasco, Veracruz; Countries: Guatemala; Waters: Pacific Ocean",maps/locators/mexico/chiapas.svg,maps/base/mexico/mexico-states.svg,
mexico,Mexico,federative entity,chihuahua,Chihuahua,Q655,https://en.wikipedia.org/wiki/Chihuahua_%28state%29,Chihuahua City,Q61302,https://en.wikipedia.org/wiki/Chihuahua_City,Coahuila | Durango | Sinaloa | Sonora,United States,,"Borders peer subdivisions: Coahuila, Durango, Sinaloa, Sonora; Countries: United States",maps/locators/mexico/chihuahua.svg,maps/base/mexico/mexico-states.svg,
mexico,Mexico,federative entity,coahuila,Coahuila,Q53079,https://en.wikipedia.org/wiki/Coahuila,Saltillo,Q53077,https://en.wikipedia.org/wiki/Saltillo,Chihuahua | Durango | Nuevo León | Zacatecas,United States,,"Borders peer subdivisions: Chihuahua, Durango, Nuevo León, Zacatecas; Countries: United States",maps/locators/mexico/coahuila.svg,maps/base/mexico/mexico-states.svg,
mexico,Mexico,federative entity,colima,Colima,Q61309,https://en.wikipedia.org/wiki/Colima,Colima,Q61320,https://en.wikipedia.org/wiki/Colima_%28city%29,Jalisco | Michoacán,,Pacific Ocean,"Borders peer subdivisions: Jalisco, Michoacán; Waters: Pacific Ocean",maps/locators/mexico/colima.svg,maps/base/mexico/mexico-states.svg,
mexico,Mexico,federative entity,durango,Durango,Q79918,https://en.wikipedia.org/wiki/Durango,Victoria de Durango,Q112813,https://en.wikipedia.org/wiki/Durango_%28city%29,Chihuahua | Coahuila | Zacatecas,,,"Borders peer subdivisions: Chihuahua, Coahuila, Zacatecas",maps/locators/mexico/durango.svg,maps/base/mexico/mexico-states.svg,
mexico,Mexico,federative entity,guanajuato,Guanajuato,Q46475,https://en.wikipedia.org/wiki/Guanajuato,Guanajuato,Q61306,https://en.wikipedia.org/wiki/Guanajuato_%28city%29,Jalisco | Michoacán | Querétaro | San Luis Potosí | Zacatecas,,,"Borders peer subdivisions: Jalisco, Michoacán, Querétaro, San Luis Potosí, Zacatecas",maps/locators/mexico/guanajuato.svg,maps/base/mexico/mexico-states.svg,
mexico,Mexico,federative entity,guerrero,Guerrero,Q60158,https://en.wikipedia.org/wiki/Guerrero,Chilpancingo de los Bravo,Q207935,https://en.wikipedia.org/wiki/Chilpancingo,Michoacán | Morelos | Oaxaca | Puebla | State of Mexico,,Pacific Ocean,"Borders peer subdivisions: Michoacán, Morelos, Oaxaca, Puebla, State of Mexico; Waters: Pacific Ocean",maps/locators/mexico/guerrero.svg,maps/base/mexico/mexico-states.svg,
mexico,Mexico,federative entity,hidalgo,Hidalgo,Q80903,https://en.wikipedia.org/wiki/Hidalgo_%28state%29,Pachuca,Q160750,https://en.wikipedia.org/wiki/Pachuca,Puebla | Querétaro | San Luis Potosí | State of Mexico | Tlaxcala | Veracruz,,,"Borders peer subdivisions: Puebla, Querétaro, San Luis Potosí, State of Mexico, Tlaxcala, Veracruz",maps/locators/mexico/hidalgo.svg,maps/base/mexico/mexico-states.svg,
mexico,Mexico,federative entity,jalisco,Jalisco,Q13160,https://en.wikipedia.org/wiki/Jalisco,Guadalajara,Q9022,https://en.wikipedia.org/wiki/Guadalajara,Aguascalientes | Colima | Guanajuato | Michoacán | Nayarit | Zacatecas,,Pacific Ocean,"Borders peer subdivisions: Aguascalientes, Colima, Guanajuato, Michoacán, Nayarit, Zacatecas; Waters: Pacific Ocean",maps/locators/mexico/jalisco.svg,maps/base/mexico/mexico-states.svg,
mexico,Mexico,federative entity,mexico-city,Mexico City,Q1489,https://en.wikipedia.org/wiki/Mexico_City,,,,Morelos | State of Mexico,,,"Borders peer subdivisions: Morelos, State of Mexico",maps/locators/mexico/mexico-city.svg,maps/base/mexico/mexico-states.svg,
mexico,Mexico,federative entity,michoacan,Michoacán,Q79861,https://en.wikipedia.org/wiki/Michoac%C3%A1n,Morelia,Q200252,https://en.wikipedia.org/wiki/Morelia,Colima | Guanajuato | Guerrero | Jalisco | Querétaro | State of Mexico,,Pacific Ocean,"Borders peer subdivisions: Colima, Guanajuato, Guerrero, Jalisco, Querétaro, State of Mexico; Waters: Pacific Ocean",maps/locators/mexico/michoacan.svg,maps/base/mexico/mexico-states.svg,
mexico,Mexico,federative entity,morelos,Morelos,Q66117,https://en.wikipedia.org/wiki/Morelos,Cuernavaca,Q204245,https://en.wikipedia.org/wiki/Cuernavaca,Guerrero | Mexico City | Puebla | State of Mexico,,,"Borders peer subdivisions: Guerrero, Mexico City, Puebla, State of Mexico",maps/locators/mexico/morelos.svg,maps/base/mexico/mexico-states.svg,
mexico,Mexico,federative entity,nayarit,Nayarit,Q79920,https://en.wikipedia.org/wiki/Nayarit,Tepic,Q207972,https://en.wikipedia.org/wiki/Tepic,Jalisco | Zacatecas,,Pacific Ocean,"Borders peer subdivisions: Jalisco, Zacatecas; Waters: Pacific Ocean",maps/locators/mexico/nayarit.svg,maps/base/mexico/mexico-states.svg,
mexico,Mexico,federative entity,nuevo-leon,Nuevo León,Q15282,https://en.wikipedia.org/wiki/Nuevo_Le%C3%B3n,Monterrey,Q81033,https://en.wikipedia.org/wiki/Monterrey,Coahuila | San Luis Potosí | Tamaulipas | Zacatecas,United States,,"Borders peer subdivisions: Coahuila, San Luis Potosí, Tamaulipas, Zacatecas; Countries: United States",maps/locators/mexico/nuevo-leon.svg,maps/base/mexico/mexico-states.svg,
mexico,Mexico,federative entity,oaxaca,Oaxaca,Q34110,https://en.wikipedia.org/wiki/Oaxaca,Oaxaca de Juárez,Q131429,https://en.wikipedia.org/wiki/Oaxaca_City,Chiapas | Guerrero | Puebla | Veracruz,,Pacific Ocean,"Borders peer subdivisions: Chiapas, Guerrero, Puebla, Veracruz; Waters: Pacific Ocean",maps/locators/mexico/oaxaca.svg,maps/base/mexico/mexico-states.svg,
mexico,Mexico,federative entity,puebla,Puebla,Q79923,https://en.wikipedia.org/wiki/Puebla,Heroica Puebla de Zaragoza,Q125293,https://en.wikipedia.org/wiki/Puebla_%28city%29,Guerrero | Hidalgo | Morelos | Oaxaca | State of Mexico | Tlaxcala | Veracruz,,,"Borders peer subdivisions: Guerrero, Hidalgo, Morelos, Oaxaca, State of Mexico, Tlaxcala, Veracruz",maps/locators/mexico/puebla.svg,maps/base/mexico/mexico-states.svg,
mexico,Mexico,federative entity,queretaro,Querétaro,Q79754,https://en.wikipedia.org/wiki/Quer%C3%A9taro,Santiago de Querétaro,Q173121,https://en.wikipedia.org/wiki/Quer%C3%A9taro_%28city%29,Guanajuato | Hidalgo | Michoacán | San Luis Potosí | State of Mexico,,,"Borders peer subdivisions: Guanajuato, Hidalgo, Michoacán, San Luis Potosí, State of Mexico",maps/locators/mexico/queretaro.svg,maps/base/mexico/mexico-states.svg,
mexico,Mexico,federative entity,quintana-roo,Quintana Roo,Q80245,https://en.wikipedia.org/wiki/Quintana_Roo,Chetumal,Q459553,https://en.wikipedia.org/wiki/Chetumal,Campeche | Yucatán,Belize,Caribbean Sea,"Borders peer subdivisions: Campeche, Yucatán; Countries: Belize; Waters: Caribbean Sea",maps/locators/mexico/quintana-roo.svg,maps/base/mexico/mexico-states.svg,
mexico,Mexico,federative entity,san-luis-potosi,San Luis Potosí,Q78980,https://en.wikipedia.org/wiki/San_Luis_Potos%C3%AD,San Luis Potosí,Q204271,https://en.wikipedia.org/wiki/San_Luis_Potos%C3%AD_%28city%29,Guanajuato | Hidalgo | Nuevo León | Querétaro | Tamaulipas | Veracruz | Zacatecas,,,"Borders peer subdivisions: Guanajuato, Hidalgo, Nuevo León, Querétaro, Tamaulipas, Veracruz, Zacatecas",maps/locators/mexico/san-luis-potosi.svg,maps/base/mexico/mexico-states.svg,
mexico,Mexico,federative entity,sinaloa,Sinaloa,Q80252,https://en.wikipedia.org/wiki/Sinaloa,Culiacán,Q211760,https://en.wikipedia.org/wiki/Culiac%C3%A1n,Chihuahua,,Gulf of California,Borders peer subdivisions: Chihuahua; Waters: Gulf of California,maps/locators/mexico/sinaloa.svg,maps/base/mexico/mexico-states.svg,
mexico,Mexico,federative entity,sonora,Sonora,Q46422,https://en.wikipedia.org/wiki/Sonora,Hermosillo,Q189138,https://en.wikipedia.org/wiki/Hermosillo,Baja California | Chihuahua,United States,Gulf of California,"Borders peer subdivisions: Baja California, Chihuahua; Countries: United States; Waters: Gulf of California",maps/locators/mexico/sonora.svg,maps/base/mexico/mexico-states.svg,
mexico,Mexico,federative entity,state-of-mexico,State of Mexico,Q82112,https://en.wikipedia.org/wiki/State_of_Mexico,Toluca de Lerdo,Q209034,https://en.wikipedia.org/wiki/Toluca,Guerrero | Hidalgo | Mexico City | Michoacán | Morelos | Puebla | Querétaro | Tlaxcala,,,"Borders peer subdivisions: Guerrero, Hidalgo, Mexico City, Michoacán, Morelos, Puebla, Querétaro, Tlaxcala",maps/locators/mexico/state-of-mexico.svg,maps/base/mexico/mexico-states.svg,
mexico,Mexico,federative entity,tabasco,Tabasco,Q80914,https://en.wikipedia.org/wiki/Tabasco,Villahermosa,Q210886,https://en.wikipedia.org/wiki/Villahermosa,Campeche | Chiapas | Veracruz,Guatemala,Gulf of Mexico,"Borders peer subdivisions: Campeche, Chiapas, Veracruz; Countries: Guatemala; Waters: Gulf of Mexico",maps/locators/mexico/tabasco.svg,maps/base/mexico/mexico-states.svg,
mexico,Mexico,federative entity,tamaulipas,Tamaulipas,Q80007,https://en.wikipedia.org/wiki/Tamaulipas,Ciudad Victoria,Q331661,https://en.wikipedia.org/wiki/Ciudad_Victoria,Nuevo León | San Luis Potosí | Veracruz,United States,Gulf of Mexico,"Borders peer subdivisions: Nuevo León, San Luis Potosí, Veracruz; Countries: United States; Waters: Gulf of Mexico",maps/locators/mexico/tamaulipas.svg,maps/base/mexico/mexico-states.svg,
mexico,Mexico,federative entity,tlaxcala,Tlaxcala,Q82681,https://en.wikipedia.org/wiki/Tlaxcala,Tlaxcala de Xicoténcatl,Q689987,https://en.wikipedia.org/wiki/Tlaxcala_%28city%29,Hidalgo | Puebla | State of Mexico,,,"Borders peer subdivisions: Hidalgo, Puebla, State of Mexico",maps/locators/mexico/tlaxcala.svg,maps/base/mexico/mexico-states.svg,
mexico,Mexico,federative entity,veracruz,Veracruz,Q60130,https://en.wikipedia.org/wiki/Veracruz,Xalapa,Q221051,https://en.wikipedia.org/wiki/Xalapa,Chiapas | Hidalgo | Oaxaca | Puebla | San Luis Potosí | Tabasco | Tamaulipas,,Gulf of Mexico,"Borders peer subdivisions: Chiapas, Hidalgo, Oaxaca, Puebla, San Luis Potosí, Tabasco, Tamaulipas; Waters: Gulf of Mexico",maps/locators/mexico/veracruz.svg,maps/base/mexico/mexico-states.svg,
mexico,Mexico,federative entity,yucatan,Yucatán,Q60176,https://en.wikipedia.org/wiki/Yucat%C3%A1n,Mérida,Q165204,https://en.wikipedia.org/wiki/M%C3%A9rida%2C_Yucat%C3%A1n,Campeche | Quintana Roo,,Gulf of Mexico,"Borders peer subdivisions: Campeche, Quintana Roo; Waters: Gulf of Mexico",maps/locators/mexico/yucatan.svg,maps/base/mexico/mexico-states.svg,
mexico,Mexico,federative entity,zacatecas,Zacatecas,Q80269,https://en.wikipedia.org/wiki/Zacatecas,Zacatecas,Q139242,https://en.wikipedia.org/wiki/Zacatecas_%28city%29,Aguascalientes | Coahuila | Durango | Guanajuato | Jalisco | Nayarit | Nuevo León | San Luis Potosí,,,"Borders peer subdivisions: Aguascalientes, Coahuila, Durango, Guanajuato, Jalisco, Nayarit, Nuevo León, San Luis Potosí",maps/locators/mexico/zacatecas.svg,maps/base/mexico/mexico-states.svg,
south-africa,South Africa,province,eastern-cape,Eastern Cape,Q130840,https://en.wikipedia.org/wiki/Eastern_Cape,Bhisho,Q209533,https://en.wikipedia.org/wiki/Bhisho,Free State | KwaZulu-Natal | Northern Cape | Western Cape,Lesotho,Indian Ocean,"Borders peer subdivisions: Free State, KwaZulu-Natal, Northern Cape, Western Cape; Countries: Lesotho; Waters: Indian Ocean",maps/locators/south-africa/eastern-cape.svg,maps/base/south-africa/south-africa-provinces.svg,
south-africa,South Africa,province,free-state,Free State,Q160284,https://en.wikipedia.org/wiki/Free_State_%28province%29,Bloemfontein,Q37701,https://en.wikipedia.org/wiki/Bloemfontein,Eastern Cape | Gauteng | KwaZulu-Natal | Mpumalanga | North West | Northern Cape,Lesotho,,"Borders peer subdivisions: Eastern Cape, Gauteng, KwaZulu-Natal, Mpumalanga, North West, Northern Cape; Countries: Lesotho",maps/locators/south-africa/free-state.svg,maps/base/south-africa/south-africa-provinces.svg,
